{
  "schema_version": "pf-core.contract.v0",
  "name": "lab-release-gate",
  "pre": {
    "require_capability": "cap:lab-release",
    "require_effect": "lab.release",
    "require_policy_ref": "policy/lab-gate.v0",
    "require_evidence_ref": "evidence/lab-signoff.v0"
  },
  "post": {
    "require_decision": "allowed",
    "require_event_safe": true
  },
  "invariant": {
    "require_trace_safe": true
  }
}
